{
  "schema": "ias.s4_8.useful_sound_diagnostic_config.v1",
  "status": "diagnostic_development_only",
  "reused_holdout": true,
  "diagnostic_only": true,
  "applicable_strata": [
    "A_controlled_boundary_sweep",
    "B_center_nominal_level"
  ],
  "detector": {
    "sample_rate_hz": 16000,
    "window_samples": 4000,
    "hop_samples": 2000,
    "basic_rms_floor": 0.002,
    "background_lower_fraction": 0.5,
    "normalized_mad_scale": 1.4826,
    "coherence_mad_multiplier": 5.0,
    "minimum_contiguous_windows": 8
  },
  "authority": {
    "creates_grant": false,
    "consumes_grant": false,
    "official_state_machine": false,
    "publishes_official_evidence": false
  },
  "scientific_constraints": {
    "uses_take_identity": false,
    "uses_target_bearing": false,
    "uses_final_confidence": false,
    "uses_bearing_correctness": false,
    "uses_acceptance_outcomes": false,
    "uses_manual_window_ranges": false,
    "uses_unsealed_playback_timing": false,
    "thresholds_unchanged": true
  }
}
